{
  "site": "example.com",
  "generated_at": "2025-08-14T18:21:06.517Z",
  "items": [
    {
      "id": "block:hello",
      "type": "doc",
      "title": "Hello",
      "version": "v1",
      "updated_at": "2025-08-14T00:00:00Z",
      "block_hash": "35b263e3ef39e06a",
      "canary": "xE4HavpQST"
    },
    {
      "id": "block:sample",
      "type": "doc",
      "title": "Sample",
      "version": "v1",
      "updated_at": "2025-08-14T17:57:31.668Z",
      "block_hash": "f65483af85dea3dc",
      "canary": "Ykdmg26PtU"
    }
  ],
  "signature": "mdElTOw9ry33pRD0QrGJd/p6C0j+3lydj2U2POFYgqYQQKeL8MTk29GxJrG052C3bKUN0oeWlQyLeE3rHDErAA==",
  "signed_fields": [
    "site",
    "generated_at",
    "items"
  ]
}